{
  "slug": "oviva-2019",
  "topic": "Bone & joint",
  "one_liner": "Noninferior at 1 year: {{n:failure_oral}} oral vs {{n:failure_iv}} IV treatment failure (risk difference {{n:risk_diff}} pp).",
  "one_liner_plain": "Oral therapy noninferior to IV at 1 year",
  "arms": {
    "oral": "intervention",
    "intravenous": "comparator"
  },
  "citation": {
    "title": "Oral versus Intravenous Antibiotics for Bone and Joint Infection",
    "short_name": "OVIVA",
    "authors": "Li HK, Rombach I, Zambellas R, et al.",
    "journal": "N Engl J Med",
    "year": 2019,
    "volume_pages": "380(5):425-436",
    "pmid": "30699315",
    "doi": "10.1056/NEJMoa1710926",
    "pubmed_url": "https://pubmed.ncbi.nlm.nih.gov/30699315/",
    "doi_url": "https://doi.org/10.1056/NEJMoa1710926"
  },
  "sections": {
    "background": "Complex bone and joint infections were long managed with surgery plus a prolonged course of intravenous antibiotics, a habit rooted in a widely cited review from decades ago that declared osteomyelitis was rarely controlled without weeks of parenteral therapy. But intravenous therapy brings catheter risks, inconvenience, and higher cost, and earlier comparative evidence was too thin to change practice. OVIVA was designed to test, pragmatically, whether oral antibiotics could replace intravenous therapy during the first weeks of treatment without losing effectiveness.",
    "methods": {
      "design": "Multicenter, open-label, parallel-group, randomized, controlled noninferiority trial (26 U.K. sites); participants were randomly assigned equally, stratified by center. Blinding was not used, because a 6-week intravenous placebo would have been unethical.",
      "population": "Adults older than 18 years being treated for acute or chronic bone or joint infection: native osteomyelitis, native joint infection, prosthetic joint infection, orthopedic fixation-device infection, or vertebral osteomyelitis. 1054 participants were randomized (527 per group); 60.6% had metalware-related infection.",
      "n_total_id": "n_total",
      "intervention": "Oral antibiotics to complete the first 6 weeks of therapy, chosen by an accredited infection specialist (up to 5 consecutive days of intravenous therapy were allowed for unrelated intercurrent infections).",
      "comparator": "Intravenous antibiotics for the first 6 weeks of therapy; adjunctive oral agents such as rifampin were permitted at the infection specialist's discretion.",
      "primary_endpoint": "Definite treatment failure within 1 year after randomization, defined by clinical, microbiologic, or histologic criteria and adjudicated by an end-point committee blinded to trial-group assignment.",
      "follow_up": "Clinical follow-up for definite treatment failure to 1 year.",
      "noninferiority_margin_id": "margin"
    },
    "results": "Among the 1054 participants (527 per group), end-point data were available for 96.3%; missing data (3.7%) were imputed. Definite treatment failure occurred in 13.2% of the oral group versus 14.6% of the intravenous group. The intention-to-treat difference was -1.4 percentage points (90% CI -4.9 to 2.2; 95% CI -5.6 to 2.9), meeting noninferiority against a 7.5-percentage-point margin. Serious adverse events were similar (27.7% intravenous vs 26.2% oral; P=0.58), catheter complications favored the oral strategy (9.4% vs 1.0%), early discontinuation was less common with oral therapy (12.8% vs 18.9%; P=0.006), and C. difficile-associated diarrhea was comparable (1.7% vs 1.0%; P=0.30). Median hospital stay was shorter with the oral strategy (11 vs 14 days), and total treatment duration did not differ (71 vs 78 days; P=0.63).",
    "conclusions": "In OVIVA, oral antibiotic therapy was noninferior to intravenous antibiotic therapy when used during the first 6 weeks for complex orthopedic infection, as assessed by treatment failure at 1 year. The authors note that the results challenge a widely accepted standard of care, and that oral therapy was associated with shorter hospital stays and fewer complications than intravenous therapy.",
    "limitations": "The trial was necessarily open-label, because exposing participants to 6 weeks of intravenous placebo would have been unethical; objective end points and blinded adjudication minimized potential bias. Follow-up lasted 1 year, so later treatment failures cannot be ruled out. Attribution of some serious adverse events was subjective. Oral therapy may not be appropriate for every patient, for example those with poor enteral absorption or pathogens resistant to oral agents.",
    "practice_impact": "OVIVA supports oral antibiotic therapy for appropriately selected patients with bone and joint infection, delivering the same 1-year failure risk with shorter hospital stays and fewer catheter complications. It challenged the long-held default to intravenous therapy and, in the authors' words, helps \"challenge a widely accepted standard of care\". Choosing and monitoring the oral regimen still requires an infection specialist. Educational summary, not medical advice."
  },
  "numbers": [
    {
      "id": "n_total",
      "label": "Participants randomized",
      "value": 1054,
      "unit": " participants",
      "arm": null,
      "ci_low": null,
      "ci_high": null,
      "source_quote": "Among the 1054 participants (527 in each group), end-point data were available for 1015 (96.3%).",
      "source": "paper",
      "status": "VERIFIED"
    },
    {
      "id": "n_per_arm",
      "label": "Participants per group",
      "value": 527,
      "unit": " participants",
      "arm": null,
      "ci_low": null,
      "ci_high": null,
      "source_quote": "Among the 1054 participants (527 in each group), end-point data were available for 1015 (96.3%).",
      "source": "paper",
      "status": "VERIFIED"
    },
    {
      "id": "endpoint_n",
      "label": "Participants with end-point data",
      "value": 1015,
      "unit": " participants",
      "arm": null,
      "ci_low": null,
      "ci_high": null,
      "source_quote": "Among the 1054 participants (527 in each group), end-point data were available for 1015 (96.3%).",
      "source": "paper",
      "status": "VERIFIED"
    },
    {
      "id": "endpoint_pct",
      "label": "End-point data available",
      "value": 96.3,
      "unit": "%",
      "arm": null,
      "ci_low": null,
      "ci_high": null,
      "source_quote": "Among the 1054 participants (527 in each group), end-point data were available for 1015 (96.3%).",
      "source": "paper",
      "status": "VERIFIED"
    },
    {
      "id": "missing_n",
      "label": "Missing end-point data",
      "value": 39,
      "unit": " participants",
      "arm": null,
      "ci_low": null,
      "ci_high": null,
      "source_quote": "Missing end-point data (39 participants, 3.7%) were imputed.",
      "source": "paper",
      "status": "VERIFIED"
    },
    {
      "id": "missing_pct",
      "label": "Missing end-point data",
      "value": 3.7,
      "unit": "%",
      "arm": null,
      "ci_low": null,
      "ci_high": null,
      "source_quote": "Missing end-point data (39 participants, 3.7%) were imputed.",
      "source": "paper",
      "status": "VERIFIED"
    },
    {
      "id": "failure_oral",
      "label": "Definite treatment failure at 1 year, oral group",
      "value": 13.2,
      "unit": "%",
      "arm": "oral",
      "ci_low": null,
      "ci_high": null,
      "source_quote": "Treatment failure occurred in 74 of 506 participants (14.6%) in the intravenous group and 67 of 509 participants (13.2%) in the oral group.",
      "source": "paper",
      "status": "VERIFIED"
    },
    {
      "id": "failure_iv",
      "label": "Definite treatment failure at 1 year, intravenous group",
      "value": 14.6,
      "unit": "%",
      "arm": "intravenous",
      "ci_low": null,
      "ci_high": null,
      "source_quote": "Treatment failure occurred in 74 of 506 participants (14.6%) in the intravenous group and 67 of 509 participants (13.2%) in the oral group.",
      "source": "paper",
      "status": "VERIFIED"
    },
    {
      "id": "fail_n_oral",
      "label": "Treatment failures, oral group",
      "value": 67,
      "unit": " participants",
      "arm": "oral",
      "ci_low": null,
      "ci_high": null,
      "source_quote": "Treatment failure occurred in 74 of 506 participants (14.6%) in the intravenous group and 67 of 509 participants (13.2%) in the oral group.",
      "source": "paper",
      "status": "VERIFIED"
    },
    {
      "id": "eval_n_oral",
      "label": "Participants with end-point data, oral group",
      "value": 509,
      "unit": " participants",
      "arm": "oral",
      "ci_low": null,
      "ci_high": null,
      "source_quote": "Treatment failure occurred in 74 of 506 participants (14.6%) in the intravenous group and 67 of 509 participants (13.2%) in the oral group.",
      "source": "paper",
      "status": "VERIFIED"
    },
    {
      "id": "fail_n_iv",
      "label": "Treatment failures, intravenous group",
      "value": 74,
      "unit": " participants",
      "arm": "intravenous",
      "ci_low": null,
      "ci_high": null,
      "source_quote": "Treatment failure occurred in 74 of 506 participants (14.6%) in the intravenous group and 67 of 509 participants (13.2%) in the oral group.",
      "source": "paper",
      "status": "VERIFIED"
    },
    {
      "id": "eval_n_iv",
      "label": "Participants with end-point data, intravenous group",
      "value": 506,
      "unit": " participants",
      "arm": "intravenous",
      "ci_low": null,
      "ci_high": null,
      "source_quote": "Treatment failure occurred in 74 of 506 participants (14.6%) in the intravenous group and 67 of 509 participants (13.2%) in the oral group.",
      "source": "paper",
      "status": "VERIFIED"
    },
    {
      "id": "risk_diff",
      "label": "Risk difference (oral minus intravenous)",
      "value": -1.4,
      "unit": " pp",